{
  "schema": "progression-corpus.v1.schema.json",
  "schema_version": "1.0.0",
  "corpus_id": "progression-to-voicing",
  "corpus_version": "1.0.0",
  "status": "draft",
  "held_out": true,
  "issue": "GuitarAlchemist/ga#627",
  "parent_issue": "GuitarAlchemist/ga#623",
  "description": "Held-out deterministic evaluation corpus for the progression-to-voicing vertical slice. Expectations state what a musically correct system must answer; they are deliberately NOT trimmed to what production currently does. Pitch classes, note spellings and voicing frets are machine generated from the chord symbols and re-verified by the loader tests.",
  "cases": [
    {
      "id": "pc-01-major-ii-v-i",
      "category": "major-ii-V-I",
      "title": "Major ii-V-I in C",
      "input": {
        "chords": [
          "Dm7",
          "G7",
          "Cmaj7"
        ],
        "canonical_chords": [
          "Dm7",
          "G7",
          "Cmaj7"
        ],
        "instrument": "guitar",
        "tuning": {
          "id": "standard",
          "name": "Standard E",
          "open_strings": [
            "E2",
            "A2",
            "D3",
            "G3",
            "B3",
            "E4"
          ]
        },
        "key_hint": null,
        "spelling_equivalence_groups": []
      },
      "expected": {
        "tonal_center": "C major",
        "acceptable_tonal_centers": [
          "C major"
        ],
        "roman_numerals": [
          "ii7",
          "V7",
          "Imaj7"
        ],
        "alternative_roman_numerals": [],
        "functions": [
          "predominant",
          "dominant",
          "tonic"
        ],
        "scale_families": [
          {
            "chord": "Dm7",
            "acceptable": [
              "D Dorian",
              "C major"
            ]
          },
          {
            "chord": "G7",
            "acceptable": [
              "G Mixolydian",
              "C major"
            ]
          },
          {
            "chord": "Cmaj7",
            "acceptable": [
              "C Ionian",
              "C major",
              "C Lydian"
            ]
          }
        ],
        "required_chord_tones": [
          {
            "chord": "Dm7",
            "quality": "minor-7",
            "root": "D",
            "root_pitch_class": 2,
            "pitch_classes": [
              2,
              5,
              9,
              0
            ],
            "notes": [
              "D",
              "F",
              "A",
              "C"
            ]
          },
          {
            "chord": "G7",
            "quality": "dominant-7",
            "root": "G",
            "root_pitch_class": 7,
            "pitch_classes": [
              7,
              11,
              2,
              5
            ],
            "notes": [
              "G",
              "B",
              "D",
              "F"
            ]
          },
          {
            "chord": "Cmaj7",
            "quality": "major-7",
            "root": "C",
            "root_pitch_class": 0,
            "pitch_classes": [
              0,
              4,
              7,
              11
            ],
            "notes": [
              "C",
              "E",
              "G",
              "B"
            ]
          }
        ],
        "explanation_facts": [
          "ii-V-I",
          "G7 resolves to Cmaj7",
          "the tritone B-F resolves to C-E"
        ],
        "voicing_sequence": {
          "tuning_id": "standard",
          "frames": [
            {
              "chord": "Dm7",
              "shape_family": "A",
              "frets_low_to_high": [
                null,
                5,
                7,
                5,
                6,
                null
              ],
              "sounded_pitch_classes": [
                0,
                2,
                5,
                9
              ]
            },
            {
              "chord": "G7",
              "shape_family": "E",
              "frets_low_to_high": [
                3,
                5,
                3,
                4,
                3,
                3
              ],
              "sounded_pitch_classes": [
                2,
                5,
                7,
                11
              ]
            },
            {
              "chord": "Cmaj7",
              "shape_family": "A",
              "frets_low_to_high": [
                null,
                3,
                5,
                4,
                5,
                null
              ],
              "sounded_pitch_classes": [
                0,
                4,
                7,
                11
              ]
            }
          ]
        }
      },
      "forbidden": {
        "tonal_centers": [
          "D major",
          "D minor",
          "G major"
        ],
        "facts": [
          "G7 is the tonic",
          "the key is D minor",
          "the key is D major"
        ]
      },
      "uncertainty": {
        "expected_behavior": "confident",
        "min_alternatives": 1,
        "max_confidence": null
      },
      "pins": {
        "issues": [
          614
        ],
        "rationale": "#614 reports Dm7 G7 Cmaj7 detected as D minor by the MCP root-only scorer; the authoritative KeyIdentificationService scores C major 3/3."
      },
      "provenance": {
        "source": "Canonical jazz cadence; the exact prefix tabulated in GuitarAlchemist/ga#614.",
        "added_in": "GuitarAlchemist/ga#627",
        "rationale": "The single most common functional cadence, and the case the first-chord tie-break is structurally worst at."
      }
    },
    {
      "id": "pc-02-minor-ii-v-i",
      "category": "minor-ii-V-i",
      "title": "Minor ii-V-i in A minor",
      "input": {
        "chords": [
          "Bm7b5",
          "E7",
          "Am"
        ],
        "canonical_chords": [
          "Bm7b5",
          "E7",
          "Am"
        ],
        "instrument": "guitar",
        "tuning": {
          "id": "standard",
          "name": "Standard E",
          "open_strings": [
            "E2",
            "A2",
            "D3",
            "G3",
            "B3",
            "E4"
          ]
        },
        "key_hint": null,
        "spelling_equivalence_groups": []
      },
      "expected": {
        "tonal_center": "A minor",
        "acceptable_tonal_centers": [
          "A minor"
        ],
        "roman_numerals": [
          "iim7b5",
          "V7",
          "i"
        ],
        "alternative_roman_numerals": [],
        "functions": [
          "predominant",
          "dominant",
          "tonic"
        ],
        "scale_families": [
          {
            "chord": "Bm7b5",
            "acceptable": [
              "B Locrian",
              "B Locrian natural 2",
              "A harmonic minor"
            ]
          },
          {
            "chord": "E7",
            "acceptable": [
              "E Phrygian dominant",
              "A harmonic minor",
              "E altered"
            ]
          },
          {
            "chord": "Am",
            "acceptable": [
              "A Aeolian",
              "A harmonic minor",
              "A natural minor"
            ]
          }
        ],
        "required_chord_tones": [
          {
            "chord": "Bm7b5",
            "quality": "half-diminished-7",
            "root": "B",
            "root_pitch_class": 11,
            "pitch_classes": [
              11,
              2,
              5,
              9
            ],
            "notes": [
              "B",
              "D",
              "F",
              "A"
            ]
          },
          {
            "chord": "E7",
            "quality": "dominant-7",
            "root": "E",
            "root_pitch_class": 4,
            "pitch_classes": [
              4,
              8,
              11,
              2
            ],
            "notes": [
              "E",
              "G#",
              "B",
              "D"
            ]
          },
          {
            "chord": "Am",
            "quality": "minor-triad",
            "root": "A",
            "root_pitch_class": 9,
            "pitch_classes": [
              9,
              0,
              4
            ],
            "notes": [
              "A",
              "C",
              "E"
            ]
          }
        ],
        "explanation_facts": [
          "minor ii-V-i",
          "E7 carries the raised leading tone G#",
          "G# comes from A harmonic minor, not A natural minor"
        ],
        "voicing_sequence": {
          "tuning_id": "standard",
          "frames": [
            {
              "chord": "Bm7b5",
              "shape_family": "A",
              "frets_low_to_high": [
                null,
                2,
                3,
                2,
                3,
                null
              ],
              "sounded_pitch_classes": [
                2,
                5,
                9,
                11
              ]
            },
            {
              "chord": "E7",
              "shape_family": "E",
              "frets_low_to_high": [
                0,
                2,
                0,
                1,
                0,
                0
              ],
              "sounded_pitch_classes": [
                2,
                4,
                8,
                11
              ]
            },
            {
              "chord": "Am",
              "shape_family": "A",
              "frets_low_to_high": [
                null,
                0,
                2,
                2,
                1,
                null
              ],
              "sounded_pitch_classes": [
                0,
                4,
                9
              ]
            }
          ]
        }
      },
      "forbidden": {
        "tonal_centers": [